{"schema_version":"1.0","event_source":"ai_demo_guardrail","event_type":"output_safety_result","request_id":"req-output-001","session_id":"sess-flowc-003","user_id":"student-user-003","model":"demo-llm","source_type":"model_output","guardrail_action":"block","detection_family":"genai_output_handling","severity":"medium","confidence":0.88,"content_excerpt":"Model output contained unsanitized HTML script tag intended for downstream rendering.","risk_flags":["unsafe_html","script_tag","output_not_sanitized"],"risk_flags_csv":"unsafe_html,script_tag,output_not_sanitized","owasp_category":"LLM05","atlas_techniques":[],"mitre_attack_ids":[],"tool_name":"","tool_args_summary":"","retrieval_source":"","expected_wazuh_rule_id":100203}
